{
  "schema": "privometry.entitlements/v1",
  "org_id": "org_01JA0000000000000000000001",
  "edition": "free",
  "features": {
    "local_guard": true,
    "scanner": true,
    "local_timeline": true,
    "community_feed": true,
    "cloud_sync": false,
    "shared_policies": false,
    "inventory": false,
    "findings_basic": false,
    "approvals": false,
    "curated_feed": false,
    "ticketing_sync": false,
    "sso_scim": false,
    "mdm_rollout": false,
    "managed_hooks": false,
    "tamper_detection": false,
    "governance": false,
    "policy_simulation": false,
    "kill_switch": false,
    "audit_replay": false,
    "compliance_reports": false,
    "siem_export": false,
    "mcp_gateway": false,
    "self_hosted": false
  },
  "limits": {
    "seats": null,
    "retention_days": 0,
    "events_per_day": 0,
    "devices_per_user": null
  },
  "valid_from": "2026-10-01T00:00:00.000Z",
  "valid_until": null,
  "grace_days": 15,
  "post_expiry_retention_days": 30,
  "state": "active",
  "issued_at": "2026-10-23T09:00:00.000Z",
  "key_id": "license:in-1:8a1f0c2e7b14d685"
}
